{
  "manifest_version": "1.1.5",
  "updated_at": "2026-07-08T00:00:00Z",
  "org": "nullius",
  "channels": [
    "stable",
    "beta",
    "dev"
  ],
  "components": {
    "citation-triangulation": {
      "type": "skill-pack",
      "repo": "nullius/skills-market",
      "channel": "dev",
      "version": "0.1.0",
      "source_path": "skills/citation-triangulation/SKILL.md"
    },
    "claim-grounding": {
      "type": "skill-pack",
      "repo": "nullius/skills-market",
      "channel": "dev",
      "version": "0.1.0",
      "source_path": "skills/claim-grounding/SKILL.md"
    },
    "codex-cli-runner": {
      "type": "skill-pack",
      "repo": "nullius/skills-market",
      "channel": "beta",
      "version": "0.1.0",
      "source_path": "skills/codex-cli-runner/SKILL.md"
    },
    "deep-literature-review": {
      "type": "skill-pack",
      "repo": "nullius/skills-market",
      "channel": "dev",
      "version": "0.1.0",
      "source_path": "skills/deep-literature-review/SKILL.md",
      "depends_on": {
        "literature-workflows": ">=0.1.0 <0.2.0"
      }
    },
    "derivation-verify": {
      "type": "skill-pack",
      "repo": "nullius/skills-market",
      "channel": "dev",
      "version": "0.1.0",
      "source_path": "skills/derivation-verify/SKILL.md",
      "depends_on": {
        "review-swarm": ">=0.1.0 <0.2.0"
      }
    },
    "dsh-cli-runner": {
      "type": "skill-pack",
      "repo": "nullius/skills-market",
      "channel": "dev",
      "version": "0.1.0",
      "source_path": "skills/dsh-cli-runner/SKILL.md"
    },
    "figure-hygiene": {
      "type": "skill-pack",
      "repo": "nullius/skills-market",
      "channel": "dev",
      "version": "0.1.0",
      "source_path": "skills/figure-hygiene/SKILL.md"
    },
    "gemini-cli-runner": {
      "type": "skill-pack",
      "repo": "nullius/skills-market",
      "channel": "beta",
      "version": "0.1.0",
      "source_path": "skills/gemini-cli-runner/SKILL.md"
    },
    "hep-calc": {
      "type": "skill-pack",
      "repo": "nullius/skills-market",
      "channel": "dev",
      "version": "0.1.0",
      "source_path": "skills/hep-calc/SKILL.md"
    },
    "hep-mcp": {
      "type": "tool-pack",
      "repo": "nullius/nullius",
      "channel": "beta",
      "version": "0.6.0"
    },
    "hep-mcp-usage": {
      "type": "skill-pack",
      "repo": "nullius/skills-market",
      "channel": "dev",
      "version": "0.1.0",
      "source_path": "skills/hep-mcp-usage/SKILL.md",
      "depends_on": {
        "hep-mcp": ">=0.6.0 <0.7.0"
      }
    },
    "idea-allocation": {
      "type": "skill-pack",
      "repo": "nullius/skills-market",
      "channel": "dev",
      "version": "0.1.0",
      "source_path": "skills/idea-allocation/SKILL.md"
    },
    "idea-generation": {
      "type": "skill-pack",
      "repo": "nullius/skills-market",
      "channel": "dev",
      "version": "0.1.0",
      "source_path": "skills/idea-generation/SKILL.md"
    },
    "idea-pairwise-match": {
      "type": "skill-pack",
      "repo": "nullius/skills-market",
      "channel": "dev",
      "version": "0.1.0",
      "source_path": "skills/idea-pairwise-match/SKILL.md"
    },
    "idea-posterior": {
      "type": "skill-pack",
      "repo": "nullius/skills-market",
      "channel": "dev",
      "version": "0.1.0",
      "source_path": "skills/idea-posterior/SKILL.md"
    },
    "julia-package": {
      "type": "skill-pack",
      "repo": "nullius/skills-market",
      "channel": "dev",
      "version": "0.1.0",
      "source_path": "skills/julia-package/SKILL.md",
      "depends_on": {
        "julia-perf": ">=0.1.0 <0.2.0"
      }
    },
    "julia-perf": {
      "type": "skill-pack",
      "repo": "nullius/skills-market",
      "channel": "dev",
      "version": "0.1.0",
      "source_path": "skills/julia-perf/SKILL.md"
    },
    "kimi-cli-runner": {
      "type": "skill-pack",
      "repo": "nullius/skills-market",
      "channel": "beta",
      "version": "0.1.0",
      "source_path": "skills/kimi-cli-runner/SKILL.md"
    },
    "literature-graph-builder": {
      "type": "skill-pack",
      "repo": "nullius/skills-market",
      "channel": "dev",
      "version": "0.1.0",
      "source_path": "skills/literature-graph-builder/SKILL.md",
      "depends_on": {
        "claim-grounding": ">=0.1.0 <0.2.0",
        "deep-literature-review": ">=0.1.0 <0.2.0",
        "markdown-hygiene": ">=0.1.0 <0.2.0",
        "review-swarm": ">=0.1.0 <0.2.0"
      }
    },
    "literature-to-package": {
      "type": "skill-pack",
      "repo": "nullius/skills-market",
      "channel": "beta",
      "version": "0.1.0",
      "source_path": "skills/literature-to-package/SKILL.md",
      "depends_on": {
        "citation-triangulation": ">=0.1.0 <0.2.0",
        "claim-grounding": ">=0.1.0 <0.2.0",
        "deep-literature-review": ">=0.1.0 <0.2.0",
        "derivation-verify": ">=0.1.0 <0.2.0",
        "julia-perf": ">=0.1.0 <0.2.0",
        "numerical-reliability-gate": ">=0.1.0 <0.2.0",
        "review-swarm": ">=0.1.0 <0.2.0"
      }
    },
    "literature-workflows": {
      "type": "workflow-pack",
      "repo": "nullius/nullius",
      "channel": "dev",
      "version": "0.1.0",
      "depends_on": {
        "hep-mcp": ">=0.6.0 <0.7.0"
      }
    },
    "markdown-hygiene": {
      "type": "skill-pack",
      "repo": "nullius/skills-market",
      "channel": "dev",
      "version": "0.1.0",
      "source_path": "skills/markdown-hygiene/SKILL.md"
    },
    "native-cli-runner": {
      "type": "skill-pack",
      "repo": "nullius/skills-market",
      "channel": "beta",
      "version": "0.1.0",
      "source_path": "skills/native-cli-runner/SKILL.md"
    },
    "numerical-reliability-gate": {
      "type": "skill-pack",
      "repo": "nullius/skills-market",
      "channel": "dev",
      "version": "0.1.0",
      "source_path": "skills/numerical-reliability-gate/SKILL.md"
    },
    "opencode-cli-runner": {
      "type": "skill-pack",
      "repo": "nullius/skills-market",
      "channel": "beta",
      "version": "0.1.0",
      "source_path": "skills/opencode-cli-runner/SKILL.md"
    },
    "paper-reviser": {
      "type": "skill-pack",
      "repo": "nullius/skills-market",
      "channel": "dev",
      "version": "0.1.0",
      "source_path": "skills/paper-reviser/SKILL.md"
    },
    "pdg-lookup": {
      "type": "skill-pack",
      "repo": "nullius/skills-market",
      "channel": "beta",
      "version": "0.1.0",
      "source_path": "skills/pdg-lookup/SKILL.md",
      "depends_on": {
        "hep-mcp": ">=0.6.0 <0.7.0"
      }
    },
    "physics-diagrams": {
      "type": "skill-pack",
      "repo": "nullius/skills-market",
      "channel": "dev",
      "version": "0.1.0",
      "source_path": "skills/physics-diagrams/SKILL.md"
    },
    "referee-review": {
      "type": "skill-pack",
      "repo": "nullius/skills-market",
      "channel": "beta",
      "version": "0.1.0",
      "source_path": "skills/referee-review/SKILL.md"
    },
    "research-harness": {
      "type": "skill-pack",
      "repo": "nullius/skills-market",
      "channel": "dev",
      "version": "0.1.0",
      "source_path": "skills/research-harness/SKILL.md",
      "depends_on": {
        "hep-mcp": ">=0.6.0 <0.7.0",
        "markdown-hygiene": ">=0.1.0 <0.2.0",
        "numerical-reliability-gate": ">=0.1.0 <0.2.0",
        "research-integrity": ">=0.1.0 <0.2.0",
        "research-team": ">=0.1.0 <0.2.0",
        "julia-package": ">=0.1.0 <0.2.0"
      }
    },
    "research-integrity": {
      "type": "skill-pack",
      "repo": "nullius/skills-market",
      "channel": "dev",
      "version": "0.1.0",
      "source_path": "skills/research-integrity/SKILL.md"
    },
    "research-team": {
      "type": "skill-pack",
      "repo": "nullius/skills-market",
      "channel": "dev",
      "version": "0.1.0",
      "source_path": "skills/research-team/SKILL.md",
      "depends_on": {
        "literature-workflows": ">=0.1.0 <0.2.0"
      }
    },
    "research-writer": {
      "type": "skill-pack",
      "repo": "nullius/skills-market",
      "channel": "dev",
      "version": "0.1.0",
      "source_path": "skills/research-writer/SKILL.md",
      "depends_on": {
        "research-team": ">=0.1.0 <0.2.0"
      }
    },
    "review-swarm": {
      "type": "skill-pack",
      "repo": "nullius/skills-market",
      "channel": "dev",
      "version": "0.1.0",
      "source_path": "skills/review-swarm/SKILL.md"
    },
    "skills-market": {
      "type": "skill-pack-index",
      "repo": "nullius/skills-market",
      "channel": "beta",
      "version": "0.1.0"
    },
    "zotero-import": {
      "type": "skill-pack",
      "repo": "nullius/skills-market",
      "channel": "beta",
      "version": "0.1.0",
      "source_path": "skills/zotero-import/SKILL.md",
      "depends_on": {
        "hep-mcp": ">=0.6.0 <0.7.0"
      }
    }
  },
  "platforms": {
    "claude_code": {
      "install_mode": "plugin-marketplace-or-local-skill-link"
    },
    "codex": {
      "install_mode": "skills-symlink"
    },
    "kimi_code": {
      "install_mode": "skills-symlink"
    },
    "opencode": {
      "install_mode": "skills-symlink-plus-plugin"
    }
  }
}
